{
  "source_language": "java",
  "source_file": "ref1.java",
  "functions": [
    {
      "name": "fibonacci",
      "return_type": "INT",
      "parameters": [
        {"name": "n", "type": "INT", "role": "DATA"}
      ],
      "body": [
        {
          "kind": "IF",
          "condition": 
            {
              "kind": "BINARY_OP",
              "operator": "<=",
              "left": 
              {"kind": "IDENTIFIER", "name": "n"},
              "right": 
              {"kind": "LITERAL", "value": "1", "type": "INT"}
            },
          "then": [
            {
              "kind": "RETURN",
              "value": 
                {"kind": "IDENTIFIER", "name": "n"}
            }
          ]
        },
        {"kind": "DECLARE", "name": "a", "type": "INT"},
        {"kind": "DECLARE", "name": "b", "type": "INT"},
        {
          "kind": "ASSIGN",
          "target": 
          {"kind": "IDENTIFIER", "name": "a"},
          "value": 
          {"kind": "LITERAL", "value": "0", "type": "INT"}
        },
        {
          "kind": "ASSIGN",
          "target": 
          {"kind": "IDENTIFIER", "name": "b"},
          "value": 
          {"kind": "LITERAL", "value": "1", "type": "INT"}
        },
        {
          "kind": "FOR_LOOP",
          "var_init": {"kind": "DECLARE", "name": "i", "type": "INT", "init": 
            {"kind": "LITERAL", "value": "2", "type": "INT"}
          },
          "condition": 
            {
              "kind": "BINARY_OP",
              "operator": "<=",
              "left": 
              {"kind": "IDENTIFIER", "name": "i"},
              "right": 
              {"kind": "IDENTIFIER", "name": "n"}
            },
          "update": 
            {
              "kind": "UNARY_OP",
              "operator": "++",
              "operand": 
              {"kind": "IDENTIFIER", "name": "i"},
              "prefix": false
            },
          "body": [
            {"kind": "DECLARE", "name": "temp", "type": "INT"},
            {
              "kind": "ASSIGN",
              "target": 
              {"kind": "IDENTIFIER", "name": "temp"},
              "value": 
              {
                "kind": "BINARY_OP",
                "operator": "+",
                "left": 
                {"kind": "IDENTIFIER", "name": "a"},
                "right": 
                {"kind": "IDENTIFIER", "name": "b"}
              }
            },
            {
              "kind": "ASSIGN",
              "target": 
              {"kind": "IDENTIFIER", "name": "a"},
              "value": 
              {"kind": "IDENTIFIER", "name": "b"}
            },
            {
              "kind": "ASSIGN",
              "target": 
              {"kind": "IDENTIFIER", "name": "b"},
              "value": 
              {"kind": "IDENTIFIER", "name": "temp"}
            }
          ]
        },
        {
          "kind": "RETURN",
          "value": 
            {"kind": "IDENTIFIER", "name": "b"}
        }
      ]
    }
  ],
  "entry_point": 
  {
    "declarations": [],
    "statements": [
      {
        "kind": "PRINT",
        "format": "{}\\n",
        "arguments": [
          {
            "kind": "BINARY_OP",
            "operator": "+",
            "left": 
            {"kind": "LITERAL", "value": "\"Fib(7) = \"", "type": "STRING"},
            "right": 
            {
              "kind": "CALL_EXPR",
              "function": "fibonacci",
              "arguments": [
                {"kind": "LITERAL", "value": "7", "type": "INT"}
              ]
            }
          }
        ]
      },
      {
        "kind": "RETURN"
      }
    ]
  }
}
