{
  "source_language": "cpp",
  "source_file": "ref1_cpp.cpp",
  "functions": [
    {
      "name": "factorial",
      "return_type": "INT",
      "parameters": [
        {"name": "n", "type": "INT", "role": "DATA"}
      ],
      "body": [
        {"kind": "DECLARE", "name": "result", "type": "INT"},
        {
          "kind": "ASSIGN",
          "target": 
          {"kind": "IDENTIFIER", "name": "result"},
          "value": 
          {"kind": "LITERAL", "value": "1", "type": "INT"}
        },
        {
          "kind": "FOR_LOOP",
          "var_init": {"kind": "DECLARE", "name": "i", "type": "INT", "init": 
            {"kind": "LITERAL", "value": "1", "type": "INT"}
          },
          "condition": 
            {
              "kind": "BINARY_OP",
              "operator": "<=",
              "left": 
              {"kind": "IDENTIFIER", "name": "i"},
              "right": 
              {"kind": "IDENTIFIER", "name": "n"}
            },
          "update": 
            {
              "kind": "UNARY_OP",
              "operator": "++",
              "operand": 
              {"kind": "IDENTIFIER", "name": "i"},
              "prefix": false
            },
          "body": [
            {
              "kind": "COMPOUND_ASSIGN",
              "target": 
              {"kind": "IDENTIFIER", "name": "result"},
              "operator": "MUL",
              "value": 
              {"kind": "IDENTIFIER", "name": "i"}
            }
          ]
        },
        {
          "kind": "RETURN",
          "value": 
            {"kind": "IDENTIFIER", "name": "result"}
        }
      ]
    }
  ],
  "entry_point": 
  {
    "declarations": [],
    "statements": [
      {
        "kind": "PRINT",
        "format": "5! = %d\\n",
        "arguments": [
          {"kind": "LITERAL", "value": "\"5! = %d\\n\"", "type": "STRING"},
          {
            "kind": "CALL_EXPR",
            "function": "factorial",
            "arguments": [
              {"kind": "LITERAL", "value": "5", "type": "INT"}
            ]
          }
        ]
      },
      {
        "kind": "RETURN",
        "value": 
          {"kind": "LITERAL", "value": "0", "type": "INT"}
      }
    ]
  }
}
