{
  "source_language": "cpp",
  "source_file": "ref1_cpp.cpp",
  "functions": [
    {
      "name": "linearSearch",
      "return_type": "INT",
      "parameters": [
        {"name": "arr", "type": "INT_ARRAY", "role": "DATA"},
        {"name": "n", "type": "INT", "role": "ARRAY_SIZE"},
        {"name": "target", "type": "INT", "role": "DATA"}
      ],
      "body": [
        {
          "kind": "FOR_LOOP",
          "var_init": {"kind": "DECLARE", "name": "i", "type": "INT", "init": 
            {"kind": "LITERAL", "value": "0", "type": "INT"}
          },
          "condition": 
            {
              "kind": "BINARY_OP",
              "operator": "<",
              "left": 
              {"kind": "IDENTIFIER", "name": "i"},
              "right": 
              {"kind": "IDENTIFIER", "name": "n"}
            },
          "update": 
            {
              "kind": "UNARY_OP",
              "operator": "++",
              "operand": 
              {"kind": "IDENTIFIER", "name": "i"},
              "prefix": false
            },
          "body": [
            {
              "kind": "IF",
              "condition": 
                {
                  "kind": "BINARY_OP",
                  "operator": "==",
                  "left": 
                  {
                    "kind": "ARRAY_ACCESS",
                    "array": 
                    {"kind": "IDENTIFIER", "name": "arr"},
                    "index": 
                    {"kind": "IDENTIFIER", "name": "i"}
                  },
                  "right": 
                  {"kind": "IDENTIFIER", "name": "target"}
                },
              "then": [
                {
                  "kind": "RETURN",
                  "value": 
                    {"kind": "IDENTIFIER", "name": "i"}
                }
              ]
            }
          ]
        },
        {
          "kind": "RETURN",
          "value": 
            {
              "kind": "UNARY_OP",
              "operator": "-",
              "operand": 
              {"kind": "LITERAL", "value": "1", "type": "INT"},
              "prefix": true
            }
        }
      ]
    }
  ],
  "entry_point": 
  {
    "declarations": [],
    "statements": [
      {"kind": "DECLARE", "name": "arr", "type": "INT_ARRAY"},
      {
        "kind": "ASSIGN",
        "target": 
        {"kind": "IDENTIFIER", "name": "arr"},
        "value": 
        {
          "kind": "CALL_EXPR",
          "function": "arrayInitializer",
          "arguments": [
            {"kind": "LITERAL", "value": "10", "type": "INT"},
            {"kind": "LITERAL", "value": "23", "type": "INT"},
            {"kind": "LITERAL", "value": "45", "type": "INT"},
            {"kind": "LITERAL", "value": "67", "type": "INT"},
            {"kind": "LITERAL", "value": "89", "type": "INT"}
          ]
        }
      },
      {
        "kind": "PRINT",
        "format": "Index: %d\\n",
        "arguments": [
          {"kind": "LITERAL", "value": "\"Index: %d\\n\"", "type": "STRING"},
          {
            "kind": "CALL_EXPR",
            "function": "linearSearch",
            "arguments": [
              {"kind": "IDENTIFIER", "name": "arr"},
              {"kind": "LITERAL", "value": "5", "type": "INT"},
              {"kind": "LITERAL", "value": "45", "type": "INT"}
            ]
          }
        ]
      },
      {
        "kind": "RETURN",
        "value": 
          {"kind": "LITERAL", "value": "0", "type": "INT"}
      }
    ]
  }
}
