{
  "source_language": "cpp",
  "source_file": "ref1_cpp.cpp",
  "functions": [
    {
      "name": "findMinimum",
      "return_type": "INT",
      "parameters": [
        {"name": "arr", "type": "INT_ARRAY", "role": "DATA"},
        {"name": "n", "type": "INT", "role": "ARRAY_SIZE"}
      ],
      "body": [
        {"kind": "DECLARE", "name": "min", "type": "INT"},
        {
          "kind": "ASSIGN",
          "target": 
          {"kind": "IDENTIFIER", "name": "min"},
          "value": 
          {
            "kind": "ARRAY_ACCESS",
            "array": 
            {"kind": "IDENTIFIER", "name": "arr"},
            "index": 
            {"kind": "LITERAL", "value": "0", "type": "INT"}
          }
        },
        {
          "kind": "FOR_LOOP",
          "var_init": {"kind": "DECLARE", "name": "i", "type": "INT", "init": 
            {"kind": "LITERAL", "value": "1", "type": "INT"}
          },
          "condition": 
            {
              "kind": "BINARY_OP",
              "operator": "<",
              "left": 
              {"kind": "IDENTIFIER", "name": "i"},
              "right": 
              {"kind": "IDENTIFIER", "name": "n"}
            },
          "update": 
            {
              "kind": "UNARY_OP",
              "operator": "++",
              "operand": 
              {"kind": "IDENTIFIER", "name": "i"},
              "prefix": false
            },
          "body": [
            {
              "kind": "IF",
              "condition": 
                {
                  "kind": "BINARY_OP",
                  "operator": "<",
                  "left": 
                  {
                    "kind": "ARRAY_ACCESS",
                    "array": 
                    {"kind": "IDENTIFIER", "name": "arr"},
                    "index": 
                    {"kind": "IDENTIFIER", "name": "i"}
                  },
                  "right": 
                  {"kind": "IDENTIFIER", "name": "min"}
                },
              "then": [
                {
                  "kind": "ASSIGN",
                  "target": 
                  {"kind": "IDENTIFIER", "name": "min"},
                  "value": 
                  {
                    "kind": "ARRAY_ACCESS",
                    "array": 
                    {"kind": "IDENTIFIER", "name": "arr"},
                    "index": 
                    {"kind": "IDENTIFIER", "name": "i"}
                  }
                }
              ]
            }
          ]
        },
        {
          "kind": "RETURN",
          "value": 
            {"kind": "IDENTIFIER", "name": "min"}
        }
      ]
    }
  ],
  "entry_point": 
  {
    "declarations": [],
    "statements": [
      {"kind": "DECLARE", "name": "arr", "type": "INT_ARRAY"},
      {
        "kind": "ASSIGN",
        "target": 
        {"kind": "IDENTIFIER", "name": "arr"},
        "value": 
        {
          "kind": "CALL_EXPR",
          "function": "arrayInitializer",
          "arguments": [
            {"kind": "LITERAL", "value": "34", "type": "INT"},
            {"kind": "LITERAL", "value": "15", "type": "INT"},
            {"kind": "LITERAL", "value": "88", "type": "INT"},
            {"kind": "LITERAL", "value": "2", "type": "INT"},
            {"kind": "LITERAL", "value": "10", "type": "INT"}
          ]
        }
      },
      {"kind": "DECLARE", "name": "result", "type": "INT"},
      {
        "kind": "ASSIGN",
        "target": 
        {"kind": "IDENTIFIER", "name": "result"},
        "value": 
        {
          "kind": "CALL_EXPR",
          "function": "findMinimum",
          "arguments": [
            {"kind": "IDENTIFIER", "name": "arr"},
            {"kind": "LITERAL", "value": "5", "type": "INT"}
          ]
        }
      },
      {
        "kind": "PRINT",
        "format": "{}\\n",
        "arguments": [
          {"kind": "LITERAL", "value": "\"Result: \"", "type": "STRING"},
          {"kind": "IDENTIFIER", "name": "result"}
        ]
      },
      {
        "kind": "RETURN",
        "value": 
          {"kind": "LITERAL", "value": "0", "type": "INT"}
      }
    ]
  }
}
