{
  "source_language": "java",
  "source_file": "ref1.java",
  "functions": [
    {
      "name": "selectionSort",
      "return_type": "VOID",
      "parameters": [
        {"name": "arr", "type": "INT_ARRAY", "role": "DATA"},
        {"name": "n", "type": "INT", "role": "ARRAY_SIZE"}
      ],
      "body": [
        {
          "kind": "FOR_LOOP",
          "var_init": {"kind": "DECLARE", "name": "i", "type": "INT", "init": 
            {"kind": "LITERAL", "value": "0", "type": "INT"}
          },
          "condition": 
            {
              "kind": "BINARY_OP",
              "operator": "<",
              "left": 
              {"kind": "IDENTIFIER", "name": "i"},
              "right": 
              {
                "kind": "BINARY_OP",
                "operator": "-",
                "left": 
                {"kind": "IDENTIFIER", "name": "n"},
                "right": 
                {"kind": "LITERAL", "value": "1", "type": "INT"}
              }
            },
          "update": 
            {
              "kind": "UNARY_OP",
              "operator": "++",
              "operand": 
              {"kind": "IDENTIFIER", "name": "i"},
              "prefix": false
            },
          "body": [
            {"kind": "DECLARE", "name": "minIdx", "type": "INT"},
            {
              "kind": "ASSIGN",
              "target": 
              {"kind": "IDENTIFIER", "name": "minIdx"},
              "value": 
              {"kind": "IDENTIFIER", "name": "i"}
            },
            {
              "kind": "FOR_LOOP",
              "var_init": {"kind": "DECLARE", "name": "j", "type": "INT", "init": 
                {
                  "kind": "BINARY_OP",
                  "operator": "+",
                  "left": 
                  {"kind": "IDENTIFIER", "name": "i"},
                  "right": 
                  {"kind": "LITERAL", "value": "1", "type": "INT"}
                }
              },
              "condition": 
                {
                  "kind": "BINARY_OP",
                  "operator": "<",
                  "left": 
                  {"kind": "IDENTIFIER", "name": "j"},
                  "right": 
                  {"kind": "IDENTIFIER", "name": "n"}
                },
              "update": 
                {
                  "kind": "UNARY_OP",
                  "operator": "++",
                  "operand": 
                  {"kind": "IDENTIFIER", "name": "j"},
                  "prefix": false
                },
              "body": [
                {
                  "kind": "IF",
                  "condition": 
                    {
                      "kind": "BINARY_OP",
                      "operator": "<",
                      "left": 
                      {
                        "kind": "ARRAY_ACCESS",
                        "array": 
                        {"kind": "IDENTIFIER", "name": "arr"},
                        "index": 
                        {"kind": "IDENTIFIER", "name": "j"}
                      },
                      "right": 
                      {
                        "kind": "ARRAY_ACCESS",
                        "array": 
                        {"kind": "IDENTIFIER", "name": "arr"},
                        "index": 
                        {"kind": "IDENTIFIER", "name": "minIdx"}
                      }
                    },
                  "then": [
                    {
                      "kind": "ASSIGN",
                      "target": 
                      {"kind": "IDENTIFIER", "name": "minIdx"},
                      "value": 
                      {"kind": "IDENTIFIER", "name": "j"}
                    }
                  ]
                }
              ]
            },
            {"kind": "DECLARE", "name": "temp", "type": "INT"},
            {
              "kind": "ASSIGN",
              "target": 
              {"kind": "IDENTIFIER", "name": "temp"},
              "value": 
              {
                "kind": "ARRAY_ACCESS",
                "array": 
                {"kind": "IDENTIFIER", "name": "arr"},
                "index": 
                {"kind": "IDENTIFIER", "name": "i"}
              }
            },
            {
              "kind": "ASSIGN",
              "target": 
              {
                "kind": "ARRAY_ACCESS",
                "array": 
                {"kind": "IDENTIFIER", "name": "arr"},
                "index": 
                {"kind": "IDENTIFIER", "name": "i"}
              },
              "value": 
              {
                "kind": "ARRAY_ACCESS",
                "array": 
                {"kind": "IDENTIFIER", "name": "arr"},
                "index": 
                {"kind": "IDENTIFIER", "name": "minIdx"}
              }
            },
            {
              "kind": "ASSIGN",
              "target": 
              {
                "kind": "ARRAY_ACCESS",
                "array": 
                {"kind": "IDENTIFIER", "name": "arr"},
                "index": 
                {"kind": "IDENTIFIER", "name": "minIdx"}
              },
              "value": 
              {"kind": "IDENTIFIER", "name": "temp"}
            }
          ]
        }
      ]
    }
  ],
  "entry_point": 
  {
    "declarations": [],
    "statements": [
      {"kind": "DECLARE", "name": "arr", "type": "INT_ARRAY"},
      {
        "kind": "ASSIGN",
        "target": 
        {"kind": "IDENTIFIER", "name": "arr"},
        "value": 
        {
          "kind": "CALL_EXPR",
          "function": "arrayInitializer",
          "arguments": [
            {"kind": "LITERAL", "value": "64", "type": "INT"},
            {"kind": "LITERAL", "value": "25", "type": "INT"},
            {"kind": "LITERAL", "value": "12", "type": "INT"},
            {"kind": "LITERAL", "value": "22", "type": "INT"},
            {"kind": "LITERAL", "value": "11", "type": "INT"}
          ]
        }
      },
      {"kind": "DECLARE", "name": "n", "type": "INT"},
      {
        "kind": "ASSIGN",
        "target": 
        {"kind": "IDENTIFIER", "name": "n"},
        "value": 
        {"kind": "LITERAL", "value": "5", "type": "INT"}
      },
      {
        "kind": "CALL",
        "function": "selectionSort",
        "arguments": [
          {"kind": "IDENTIFIER", "name": "arr"},
          {"kind": "IDENTIFIER", "name": "n"}
        ]
      },
      {
        "kind": "FOR_LOOP",
        "var_init": {"kind": "DECLARE", "name": "i", "type": "INT", "init": 
          {"kind": "LITERAL", "value": "0", "type": "INT"}
        },
        "condition": 
          {
            "kind": "BINARY_OP",
            "operator": "<",
            "left": 
            {"kind": "IDENTIFIER", "name": "i"},
            "right": 
            {"kind": "IDENTIFIER", "name": "n"}
          },
        "update": 
          {
            "kind": "UNARY_OP",
            "operator": "++",
            "operand": 
            {"kind": "IDENTIFIER", "name": "i"},
            "prefix": false
          },
        "body": [
          {
            "kind": "PRINT",
            "format": "{}",
            "arguments": [
              {
                "kind": "BINARY_OP",
                "operator": "+",
                "left": 
                {
                  "kind": "ARRAY_ACCESS",
                  "array": 
                  {"kind": "IDENTIFIER", "name": "arr"},
                  "index": 
                  {"kind": "IDENTIFIER", "name": "i"}
                },
                "right": 
                {"kind": "LITERAL", "value": "\" \"", "type": "STRING"}
              }
            ]
          }
        ]
      },
      {
        "kind": "PRINT",
        "format": "{}\\n",
        "arguments": [

        ]
      }
    ]
  }
}
